<?xml version="1.0" ?>
<informationTable xsi:schemaLocation="http://www.sec.gov/edgar/document/thirteenf/informationtable eis_13FDocument.xsd" xmlns="http://www.sec.gov/edgar/document/thirteenf/informationtable" xmlns:n1="http://www.sec.gov/edgar/document/thirteenf/informationtable" xmlns:xsi="http://www.w3.org/2001/XMLSchema-instance">
  <infoTable>
    <nameOfIssuer>RICE ACQUISITION CORP 3</nameOfIssuer>
    <titleOfClass>*W EXP 99/99/999</titleOfClass>
    <cusip>G7553X114</cusip>
    <value>320000</value>
    <shrsOrPrnAmt>
      <sshPrnamt>400000</sshPrnamt>
      <sshPrnamtType>SH</sshPrnamtType>
    </shrsOrPrnAmt>
    <investmentDiscretion>SOLE</investmentDiscretion>
    <votingAuthority>
      <Sole>400000</Sole>
      <Shared>0</Shared>
      <None>0</None>
    </votingAuthority>
  </infoTable>
  <infoTable>
    <nameOfIssuer>RICE ACQUISITION CORP 3</nameOfIssuer>
    <titleOfClass>ORD SHS CL A</titleOfClass>
    <cusip>G7553X106</cusip>
    <figi>BBG01X0FFN50</figi>
    <value>24600000</value>
    <shrsOrPrnAmt>
      <sshPrnamt>2400000</sshPrnamt>
      <sshPrnamtType>SH</sshPrnamtType>
    </shrsOrPrnAmt>
    <investmentDiscretion>SOLE</investmentDiscretion>
    <votingAuthority>
      <Sole>2400000</Sole>
      <Shared>0</Shared>
      <None>0</None>
    </votingAuthority>
  </infoTable>
</informationTable>